{
  "schema_version": 1,
  "evidence_scope": "internal_fixture_evidence",
  "dataset": "golden_12_month.parquet",
  "generator": "tooling/generate_golden_12_month.sql",
  "duckdb_version": "1.3.2",
  "parquet_magic": "PAR1",
  "row_count": 432,
  "row_group_count": 1,
  "ordered_columns": [
    "schema_version",
    "tenant_id",
    "window_month",
    "auction_id",
    "auction_name",
    "auction_mode",
    "auction_closed_at",
    "policy_version",
    "load_id",
    "load_external_ref",
    "lane_id",
    "origin_region",
    "destination_region",
    "equipment_type",
    "service_priority",
    "reserve_price",
    "load_sequence",
    "bid_id",
    "carrier_id",
    "carrier_public_name",
    "idempotency_key",
    "bid_amount",
    "accessorial_cost",
    "submitted_at",
    "valid_until",
    "bid_status",
    "service_score_snapshot",
    "reliability_score",
    "historical_otd_rate",
    "withdrawal_rate",
    "incumbent",
    "first_acceptable_rank",
    "historical_awarded",
    "delivered_on_time",
    "withdrawn_after_award",
    "actual_landed_cost",
    "baseline_eligible"
  ],
  "column_schema": [
    {
      "name": "schema_version",
      "logical_type": "SMALLINT",
      "nullable": false
    },
    {
      "name": "tenant_id",
      "logical_type": "VARCHAR",
      "nullable": false
    },
    {
      "name": "window_month",
      "logical_type": "DATE",
      "nullable": false
    },
    {
      "name": "auction_id",
      "logical_type": "VARCHAR",
      "nullable": false
    },
    {
      "name": "auction_name",
      "logical_type": "VARCHAR",
      "nullable": false
    },
    {
      "name": "auction_mode",
      "logical_type": "VARCHAR",
      "nullable": false
    },
    {
      "name": "auction_closed_at",
      "logical_type": "TIMESTAMP WITH TIME ZONE",
      "nullable": false
    },
    {
      "name": "policy_version",
      "logical_type": "INTEGER",
      "nullable": false
    },
    {
      "name": "load_id",
      "logical_type": "VARCHAR",
      "nullable": false
    },
    {
      "name": "load_external_ref",
      "logical_type": "VARCHAR",
      "nullable": false
    },
    {
      "name": "lane_id",
      "logical_type": "VARCHAR",
      "nullable": false
    },
    {
      "name": "origin_region",
      "logical_type": "VARCHAR",
      "nullable": false
    },
    {
      "name": "destination_region",
      "logical_type": "VARCHAR",
      "nullable": false
    },
    {
      "name": "equipment_type",
      "logical_type": "VARCHAR",
      "nullable": false
    },
    {
      "name": "service_priority",
      "logical_type": "VARCHAR",
      "nullable": false
    },
    {
      "name": "reserve_price",
      "logical_type": "DECIMAL(12,2)",
      "nullable": false
    },
    {
      "name": "load_sequence",
      "logical_type": "INTEGER",
      "nullable": false
    },
    {
      "name": "bid_id",
      "logical_type": "VARCHAR",
      "nullable": false
    },
    {
      "name": "carrier_id",
      "logical_type": "VARCHAR",
      "nullable": false
    },
    {
      "name": "carrier_public_name",
      "logical_type": "VARCHAR",
      "nullable": false
    },
    {
      "name": "idempotency_key",
      "logical_type": "VARCHAR",
      "nullable": false
    },
    {
      "name": "bid_amount",
      "logical_type": "DECIMAL(12,2)",
      "nullable": false
    },
    {
      "name": "accessorial_cost",
      "logical_type": "DECIMAL(12,2)",
      "nullable": false
    },
    {
      "name": "submitted_at",
      "logical_type": "TIMESTAMP WITH TIME ZONE",
      "nullable": false
    },
    {
      "name": "valid_until",
      "logical_type": "TIMESTAMP WITH TIME ZONE",
      "nullable": false
    },
    {
      "name": "bid_status",
      "logical_type": "VARCHAR",
      "nullable": false
    },
    {
      "name": "service_score_snapshot",
      "logical_type": "DECIMAL(5,4)",
      "nullable": false
    },
    {
      "name": "reliability_score",
      "logical_type": "DECIMAL(5,4)",
      "nullable": false
    },
    {
      "name": "historical_otd_rate",
      "logical_type": "DECIMAL(5,4)",
      "nullable": false
    },
    {
      "name": "withdrawal_rate",
      "logical_type": "DECIMAL(5,4)",
      "nullable": false
    },
    {
      "name": "incumbent",
      "logical_type": "BOOLEAN",
      "nullable": false
    },
    {
      "name": "first_acceptable_rank",
      "logical_type": "INTEGER",
      "nullable": false
    },
    {
      "name": "historical_awarded",
      "logical_type": "BOOLEAN",
      "nullable": false
    },
    {
      "name": "delivered_on_time",
      "logical_type": "BOOLEAN",
      "nullable": false
    },
    {
      "name": "withdrawn_after_award",
      "logical_type": "BOOLEAN",
      "nullable": false
    },
    {
      "name": "actual_landed_cost",
      "logical_type": "DECIMAL(12,2)",
      "nullable": false
    },
    {
      "name": "baseline_eligible",
      "logical_type": "BOOLEAN",
      "nullable": false
    }
  ],
  "monthly_counts": [
    {
      "tenant_id": "11111111-1111-4111-8111-111111111111",
      "window_month": "2025-01-01",
      "row_count": 18
    },
    {
      "tenant_id": "11111111-1111-4111-8111-111111111111",
      "window_month": "2025-02-01",
      "row_count": 18
    },
    {
      "tenant_id": "11111111-1111-4111-8111-111111111111",
      "window_month": "2025-03-01",
      "row_count": 18
    },
    {
      "tenant_id": "11111111-1111-4111-8111-111111111111",
      "window_month": "2025-04-01",
      "row_count": 18
    },
    {
      "tenant_id": "11111111-1111-4111-8111-111111111111",
      "window_month": "2025-05-01",
      "row_count": 18
    },
    {
      "tenant_id": "11111111-1111-4111-8111-111111111111",
      "window_month": "2025-06-01",
      "row_count": 18
    },
    {
      "tenant_id": "11111111-1111-4111-8111-111111111111",
      "window_month": "2025-07-01",
      "row_count": 18
    },
    {
      "tenant_id": "11111111-1111-4111-8111-111111111111",
      "window_month": "2025-08-01",
      "row_count": 18
    },
    {
      "tenant_id": "11111111-1111-4111-8111-111111111111",
      "window_month": "2025-09-01",
      "row_count": 18
    },
    {
      "tenant_id": "11111111-1111-4111-8111-111111111111",
      "window_month": "2025-10-01",
      "row_count": 18
    },
    {
      "tenant_id": "11111111-1111-4111-8111-111111111111",
      "window_month": "2025-11-01",
      "row_count": 18
    },
    {
      "tenant_id": "11111111-1111-4111-8111-111111111111",
      "window_month": "2025-12-01",
      "row_count": 18
    },
    {
      "tenant_id": "22222222-2222-4222-8222-222222222222",
      "window_month": "2025-01-01",
      "row_count": 18
    },
    {
      "tenant_id": "22222222-2222-4222-8222-222222222222",
      "window_month": "2025-02-01",
      "row_count": 18
    },
    {
      "tenant_id": "22222222-2222-4222-8222-222222222222",
      "window_month": "2025-03-01",
      "row_count": 18
    },
    {
      "tenant_id": "22222222-2222-4222-8222-222222222222",
      "window_month": "2025-04-01",
      "row_count": 18
    },
    {
      "tenant_id": "22222222-2222-4222-8222-222222222222",
      "window_month": "2025-05-01",
      "row_count": 18
    },
    {
      "tenant_id": "22222222-2222-4222-8222-222222222222",
      "window_month": "2025-06-01",
      "row_count": 18
    },
    {
      "tenant_id": "22222222-2222-4222-8222-222222222222",
      "window_month": "2025-07-01",
      "row_count": 18
    },
    {
      "tenant_id": "22222222-2222-4222-8222-222222222222",
      "window_month": "2025-08-01",
      "row_count": 18
    },
    {
      "tenant_id": "22222222-2222-4222-8222-222222222222",
      "window_month": "2025-09-01",
      "row_count": 18
    },
    {
      "tenant_id": "22222222-2222-4222-8222-222222222222",
      "window_month": "2025-10-01",
      "row_count": 18
    },
    {
      "tenant_id": "22222222-2222-4222-8222-222222222222",
      "window_month": "2025-11-01",
      "row_count": 18
    },
    {
      "tenant_id": "22222222-2222-4222-8222-222222222222",
      "window_month": "2025-12-01",
      "row_count": 18
    }
  ],
  "artifact_sha256": "5c0a3e9091e12b405855c77a089c775cd83e1248371d8117113a727d49ad5c56"
}
